{
  "$schema": "http://json-schema.org/draft-07/schema#",
  "title": "InfraHealthProbe Target",
  "type": "object",
  "required": ["TargetId", "ProbeProfile"],
  "anyOf": [
    { "required": ["FQDN"] },
    { "required": ["IPAddress"] }
  ],
  "properties": {
    "TargetId": { "type": "string", "minLength": 1 },
    "Type": { "type": "string" },
    "Location": { "type": "string" },
    "Function": { "type": "string" },
    "Hostname": { "type": "string" },
    "FQDN": { "type": "string" },
    "IPAddress": { "type": "string" },
    "OS": { "type": "string" },
    "Urls": { "type": "array", "items": { "type": "string", "format": "uri" } },
    "Ports": { "type": "array", "items": { "type": "integer", "minimum": 1, "maximum": 65535 } },
    "ProbeProfile": { "type": "string", "minLength": 1 },
    "Enabled": { "type": "boolean", "default": true },
    "Priority": { "type": "string", "enum": ["Critical", "High", "Normal", "Low"] },
    "OwnerGroup": { "type": "string" },
    "Notes": { "type": "string" }
  },
  "additionalProperties": false
}
